{
  "event_id": "01K4EXAMPLE0000000000000001",
  "event_type": "erp.purchase-order.completed.v1",
  "schema_version": "1.0",
  "occurred_at": "2026-09-06T09:00:00Z",
  "source": "baobab-erp",
  "correlation_id": "01K4EXAMPLECORRELATION00001",
  "causation_id": null,
  "tenant_id": "01K4EXAMPLETENANT000000000",
  "entity_id": "THAMANI-GLOBAL",
  "payload": {
    "purchase_order_id": "canonical-po-example",
    "currency": "USD"
  }
}
