{
  "event_id": "01K4EXAMPLE0000000000000000",
  "event_type": "trade.order.accepted",
  "schema_version": "1.0",
  "occurred_at": "2026-08-30T12:00:00Z",
  "source": "baobab-trade",
  "correlation_id": "01K4EXAMPLECORRELATION00000",
  "causation_id": null,
  "tenant_id": "01K4EXAMPLETENANT000000000",
  "entity_id": "THAMANI-GLOBAL",
  "payload": {
    "trade_order_id": "trade_order_example",
    "currency": "USD"
  }
}
